ano,UF,nome_programa,titulo,resumo,autor
2002,SC,SOCIOLOGIA POLÍTICA,A AVALIAÇÃO DO SISTEMA DE ENSINO SUPERIOR BRASILEIRO - A DISPUTA ENTRE DISCURSOS E DADOS,"Considerando as possibilidades de pesquisas que podem e são desenvolvidas sobre o ensino superior brasileiro e vasta gama de informações criadas nos últimos anos, principalmente através dos processos avaliativos implantados pelo Ministério da Educação – MEC, após a Lei de Diretrizes e Bases – LDB/96, buscamos nesse trabalho analisar e avaliar os principais discursos sobre o processo avaliativo, bem como os resultados obtidos a partir dos dados publicizados pelo Ministério desde a implementação dos mecanismos avaliativos (de 1997 a 2000).....Assim como não podia deixar de faltar, nossa pesquisa aborda as questões centrais das políticas de ensino superior brasileiras dos últimos anos, visando sempre uma reflexão sobre seus pontos mais importantes, buscando na imensa literatura os autores que produzem os trabalhos mais significativos quanto ao tema. Ampliando as possibilidades de discussões e apontando para os critérios avaliados, essa pesquisa, despretensiosamente, busca trazer para o debate novos subsídios e ponderações quanto a pertinência das avaliações feitas pelo MEC, bem como a manipulação dos resultados obtidos.....Juntamente com uma apropriação dos discursos dos principais atores envolvidos, fizemos a análise dos dados publicados, partindo dos indicadores mais expressivos que possibilitariam estabelecer alguma relação com os discursos. Fazendo a correlação de alguns indicadores e buscando deles extrair percentuais para uma maior aproximação da realidade, compreendendo sua pertinência e identificando as relações possíveis, chegamos ao fim de nossa pesquisa com a angústia de perceber o quanto os discursos utilizados pelo Ministério, ou melhor, pelos seus representantes, não se correspondem, havendo entre eles estão desconexos e fora da realidade social brasileira.",MÍRIAN ELIZABETH HAHMEYER COLLARES
2002,DF,SOCIOLOGIA,O PIBIC e a difusão da carreira científica na Universidade Brasília,"O objeto de análise da presente dissertação é o Programa Institucional de Bolsas de Iniciação Científica - PIBIC, promovido pelo Conselho Nacional de Desenvolvimento Científico e Tecnológico - CNPq. O Programa, há mais de dez anos, concede bolsas de estudos a alunos de graduação, proporcionando-lhes a oportunidade de participar de projetos de pesquisa científica, sob a orientação de um professor pesquisador. Nessa década de existência, o Programa apresenta considerável expansão e atualmente chega a oferecer cerca de quatorze mil bolsas por ano. Esta dissertação tem por objetivo analisar a função precípua do PIBIC na formação de estudantes de graduação para o ingresso no campo científico. Analisa-se, ainda, a interação do Programa com o sistema de ensino superior brasileiro e a forma como influencia a socialização dos estudantes que dele participam. Ademais, procura-se esclarecer em que medida o Programa contribui para consolidar a carreira acadêmico-científica no País.",Adalberto Grassi Gonçalves
2003,SP,SOCIOLOGIA,Mas afinal que elite é essa? Elitização/deselitização no Vestibular VUNESP,"Esta pesquisa tem como um de seus objetivos principais discutir o conceito de elite no contexto da universidade pública, a partir do vestibular VUNESP, observando e refletindo sobre a suposta elite que compõe a população universitária brasileira. A partir de dados relativos ao capital cultural, do questionário sócio-econômico da VUNESP, procurei estabelecer relações sistêmicas que ajudassem a esclarecer os diferentes aspectos da questão proposta, na tentativa de compreender os processos de elitização/deselitização em um caso específico - alguns cursos da Universidade Estadual Paulista-UNESP. Elaborei uma proposta de pesquisa que aproveita resultados de trabalhos anteriores, procurando enfocar um aspecto original, pois centra a análise em quatro campi da UNESP - eqüidistantes ao mesmo tempo do litoral e da divisa oeste do Estado de São Paulo, e trabalho com a hipótese de que os cursos aí localizados oferecem interessante amostragem da juventude universitária no que se refere a classe social e grau de urbanização - dois importantes aspectos referentes ao acesso à universidade e à heterogeneidade dos cursos.",Elis Cristina Fiamenge
2003,RJ,SOCIOLOGIA E ANTROPOLOGIA,"Por que hoje no Brasil mais mulheres buscam o ensino superior? Trajetórias educacionais, família e casamento em questão.","Esta tese analisa dois grupos de mulheres que cursam o ensino superior em instituições pública e particular do Rio de Janeiro, procurando entender qual o significado do diploma para estas mulheres e como este fato está relacionado com as temáticas da educação, família e casamento na  sociedade brasileira contemporânea...A análise das trajetórias educacionais e o relato das histórias de vida, brm como a aplicação de um questionário sócio-cultural em 140 alunas universitárias, sendo 70 de uma faculdade particular da zona oeste do Rio de Janeiro(FIA) e 70 de uma Universidade Pública (UP) da região central do Rio de Janeiro, consistiram nas estratégias adotadas para responder o questionamento de por que tantas mulheres hoje buscam concluir uma graduação...Esta pesquisa revela que na sociedade brasileira contemporânea, as mulheres estão cadavez mais buscando na conclusão do ensino superior a oportunidade de mudarem seus projetos de vida, família e casamento. Elas querem liberdade de pensamento e ação. Desejam ser percebidas como indivíduo capazes de fazer escolhas e tomar decisões.",ANA LUCIA GUIMARAES
2003,GO,SOCIOLOGIA,"ESCOLA SEM LIMITES: VIOLÊNCIA, INDISCIPLINA E AUTORIDADE DOCENTE",Reconhecendo que a violência,José Maria e Silva
2003,GO,SOCIOLOGIA,POLÍTICA SOCIAL E PRÁTICA SINDICAL NO CAMPO DA EDUCAÇÃO: FNDEP E SINTEGO,"Este trabalho procura compreender a atuação do Fórum Nacional em Defesa da Escola Pública e a prática sindical dos professores da rede pública estadual de Goiás, por meio de sua entidade representativa, o Sintego, durante a década de 90. Ambos os movimentos têm como princípio a qualidade da educação para a cidadania; as mobilizações realizadas no período adotam a defesa da escola pública unitária e para todos como principal objetivo. Tanto a prática sindical do Sintego como a atuação do Fórum ocorrem no contexto de uma sociedade extremamente autoritária, desigual e excludente, que se acirra pela consolidação no Brasil de elementos pós-modernos, como a reestruturação produtiva e o neoliberalismo, agravando ainda mais as contradições existentes no país. O referencial adotado para este estudo foi a teoria crítica da Escola de Frankfurt, pois entende-se que este referencial oferece categorias de análise privilegiadas para a compreensão da sociedade contemporãnea.",Rubens de Freitas Benevides
2003,SP,SOCIOLOGIA,RACISMOS E ANTI-RACISMOS NA PERSPECTIVA DE ESTUDANTES UNIVERSITÁRIOS DE SÃO PAULO,"Esse trabalho analisa os discursos sobre ""raça"", racismo e anti-racismo no Brasil.  Com base em uma pesquisa empírica realizada entre estudantes de uma universidade pública de São Paulo, examina as definições do racismo que tem sido popularizadas na sociedade, e o modo como a sua presença é percebida no cotidiano e nas trajetórias individuais.  Além disso, tratadas explanações para a desigualdade racializada e, especificamente, para exclusão dos ""negros"" de espaços socialmente valorizados, como as universidades públicas brasileiras, examinando o impacto destas sobre as preferências individuais em termos de políticas anti-racistas.  O trabalho discute, ainda, as inter´retações divergentes para as posições em relação às políticas anti-racistas e, especificamente, à ação afirmativa presentes no debate público norte-americano e brasileiro em torno do assunto.",Paula Cristina da Silva Barreto
2003,PR,SOCIOLOGIA,TRABALHO INFANTIL: uma análise das tentativas de sua erradicação no Brasil,"O trabalho infantil é abordado nesta pesquisa, sob o prisma..sociológico de sua constituição como problema social. A partir de sua..contextualização, analisa-se o discurso da erradicação do trabalho infantil..e as iniciativas voltadas a esse fim, bem como a legislação brasileira que..respalda as ações dos projetos e programas que intervêm na realidade social,..no que tange à infância e adolescência no Brasil.",Ester Cardoso Candelori
2003,DF,SOCIOLOGIA,"De Casa à Escola: caminho fecundo para o enfrentamento da violência doméstica contra a criança""","Esta dissertação desvela a possibilidade do espaço escolar ser local de prevenção à violência doméstica contra a criança e de acompanhamento e encaminhamento daquelas crianças identificadas, por profissionais da educação, vítimas desta expressão de violência interpessoal.....Foi possível vislumbrar tal possibilidade investigando o caminho percorrido, por profissionais da educação desde a identificação de casos de violência doméstica contra a criança até os fatores responsáveis por impulsioná-los a enfrentá-los ou impedi-los de enfrentá-los. Além desses profissionais foram ouvidos profissionais do serviço social, da justiça, da segurança pública e conselheiros tutelares.....Para tanto, foram traçados os seguintes objetivos: levantar e analisar as representações sociais de professores, orientadores educacionais e direções escolares a respeito do que é violência doméstica contra a criança; levantar e analisar as ações de professores, orientadores educacionais e direções escolares ao identificarem crianças que sofrem violência doméstica; propor tanto ações voltadas para as políticas públicas educacionais que envolvam os profissionais da educação, visando ao seu engajamento na questão do enfrentamento da violência doméstica, quanto ações governamentais voltadas para a estruturação da rede de atendimento à criança violentada no Distrito Federal.....Nesta dissertação, coloca-se, então, como primeiro resultado relevante o reconhecimento do espaço escolar como espaço fecundo tanto para a identificação quanto para o enfrentamento da violência doméstica contra crianças. O segundo resultado relevante é a superação do entendimento da denúncia como única possibilidade de enfrentamento, por parte dos profissionais da educação, da violência doméstica contra a criança, uma vez que, as atividades escolares permitem o diálogo com a comunidade escolar, bem como, a reflexão acerca do fenômeno social em questão.",Adriana Costa de Miranda
2004,RJ,SOCIOLOGIA E ANTROPOLOGIA,Herdeiros ou sobreviventes: mobilidade social no Ensino Superior no RJ.,"Este estudo procura analisar as chances de obter mobilidade social do curso de Ciências Sociais, comparativamente a outros curso, observando-se o perfil sócio-cultural dos estudantes selecionados para os mesmos. Além disso, procurou-se refletir sobre como a configuração das identidades profissionais que os cursos representam poderia interferir na continuação desse processo, no que tange ã inserção profissional do graduado. Para tal análise, foi necessário fazer uso de dados quantitativos de dois bancos de dados da UFRJ, e dados qualitativos a partir de entrevistas com ex-alunos. Os resultados mostram que não se nota grande mobilidade social entre os alunos dos cursos analisados, até mesmo por já apresentarem um certa condição social. Apesar do curso de Ciências Sociais não ser o que permite maior mobilidade social dentre os cursos analisados, proporcionada pela posse do diploma, é o que apresenta maior probabilidade de mobilidade ocupacional, quando comparado a um outro curso com perfil também acadêmico.",ANA PAULA BARBOSA LEITE
2004,RJ,SOCIOLOGIA E ANTROPOLOGIA,A sociologia volta à escola: um estudo dos manuais de sociologia para o ensino médio no Brasil.,"Essa pesquisa buscou delinear o que se tem proposto para o ensino de sociologia no ensino médio a partir de uma análise interpretativa de quatro entre os manuais didáticos de sociologia para o ensino médio publicados a partir da primeira década de 1980 no Brasil. Descreve  e analisa a estrutura, as principais idéias e a lógica que ordena e orienta os textos dos manuais investigados e sistematiza a produção acadêmica anterior. A dissertação conclui que os manuais da disciplina reproduzem um ensino com forte ênfase conceitual e fundamentado no pressuposto da sociologia como propiciadora de uma consciência crítica interventora sobre a realidade social e relevante para o desenvolvimento da cidadania. Também procura sistematizar a produção recente sobre sociologia no ensino médio a partir da recuperação de quatro dissertações de mestrado, incluindo outros estudos realizados e sugere que o campo das ciências sociais especialmente no ensino médio, é articulado por um sentimento visionário, um sentido civilizacional, não raro entre as teorias e políticas educacionais brasileiras, disso decorre uma linha de continuidade entre esses manuais e os primeiros escritos e publicados por intelectuais brasileiros nas primeiras décadas do século XX. Por fim, essa dissertação discute a indiferença, no campo das ciências sociais, sobre as questões de ensino da própria disciplina e sobre seus manuais.",FLÁVIO MARCOS SILVA SARANDY
2004,RJ,SOCIOLOGIA E ANTROPOLOGIA,"Desigualdades ""Raciais"" e Ensino Superior: Um estudo sobre a introdução das Leis de reserva de vagas para egressos de Escolas Públicas.","Este estudo pretende documentar e analisar a recente introdução de Leis de reserva de vagas para candidatos egressos de escolas públicas e cotas para ""negros e pardos"", nas universidades estaduais fluminenses. A tese analisa a repercussão de tais medidas para professores, reitores, funcionários, estudantes e demais envolvidos diretos e/ou indiretamente em uma das universidades, para a qual as Leis foram aprovadas, a Universidade do Estado do Rio de Janeiro (UERJ). Depois de relatar os eventos que precederam o primeiro vestibular com a Leis de reserva de vagas e cotas, a tese prossegue com uma análise do número de alunos ""negros ou pardos"" que entraram na universidade ou pela sererva de vagas para egressos de escolas públicas ou pelas cotas para ""negros e pardos"". Em seguida examina a reação pública à tais Leis, incluindo processos jurídicos e debates sobre a constitucionalidade das novas Leis, que em parte levaram a UERJ a propor, com êxito, a mudança da legislação reduzindo o número de vagas para negros e para egressos de escolas públicas. Para finalizar, a tese busca apontar, em certa medida, qual o significado da doção da legislação sobre ""cotas para negros"", nas universidades, para as relações raciais na sociedade brasileira como um todo, nos dias atuais.",ELIELMA AYRES MACHADO
2004,SP,SOCIOLOGIA,A ESCOLA: MUNDO ESTRANHO AO PROFESSOR (HISTÓRIA E MEMÓRIA),"Este estudo teve como objetivo principal investigar as implicações das mudanças implementadas pela última reforma educacional realizada no sistema de ensino do Estado de São Paulo a partir de 1996. Partiu-se dos relatos de professoras que vivem e trabalham em São Miguel Paulista, um antigo subúrbio da cidade de São Paulo, e que têm exercido o magistério público há mais de 20 anos. Esses relatos revelam que o mundo escolar tornou-se estranho aos sujeitos, na medida em que estes não vêem acolhidas a concepção de escola e a prática pedagógica que construíram ao longo da vida e da carreira docente. Concluiu-se que além da mais recente reforma realizada no sistema de ensino paulista, contribuíram para intensificar esse estranhamento, as políticas do regime militar e suas implicações para a formação docente e para a degradação das condições de vida no subúrbio.",Celina Fernandes Gonçalves Bruniera
2004,PR,SOCIOLOGIA,REPRESENTAÇÕES SOCIAIS E POLÍTICA DE REFORMA DO ENSINO MÉDIO NO PARANÁ (período de 1996 à 2002),"Esse trabalho analisa as Representações Sociais dos atores sociais diretamente envolvidos no processo de reforma do Ensino Médio do Paraná no período de 1996 á 2002. Tomando como referencial teórico os conceitos trabalhados na representação social, que aborda a relação do sujeito com o espaço social no qual ele está inserido. Este tratou da questão atual da reforma do Ensino Médio no Paraná, que é analisada em contexto mais amplo, partindo das diretrizes propostas nos Parâmetros Curriculares Nacionais que redefinem o universo educacional do ensino médio a partir das relações do mercado de trabalho e de consumo, procurando assim, formar individuo que atenda as novas necessidades e exigências do mercado econômico.",Sandra Ramalho de Paula
2004,RS,SOCIOLOGIA,"Conexões sociológicas entre questão social e a questão criminal: desigualdades, segregação sócio-espacial e delinqüência em Porto Alegre (2000-2003)","A presente pesquisa tem como propósito objetivar uma análise acerca dos condicionantes objetivos, estruturais e institucionais que determinam a distribuição sócio-espacial de apenados, em Porto Alegre, entre os anos de 2000 e 2003. Desse modo, intenta-se construir uma reflexão sociológica que identifique os fatores que revelam maior influência no condicionamento da probabilidade de envolvimento dos indivíduos com a questão criminal. Nesta pesquisa são abordadas quatro modalidades de crime, a saber: tráfico de entorpecentes (art. 12), homicídio doloso (art. 121), furto qualificado (art.155) e roubo (art. 157). A análise é realizada a partir de uma tipologia sócio-espacial construída para Porto Alegre, em função das categorias sócio-ocupacionais predominantes nos diferentes espaços da cidade. Tal tipologia foi desenvolvida por pesquisadores do Núcleo de Estudo Regionais e Urbanos (NERU/FEE), para o estudo das desigualdades sócio-espaciais na região metropolitana e na capital. A pesquisa se justifica tanto do ponto de vista das políticas públicas de segurança, já que se propõe a fornecer uma visão mais acurada do problema do crime, quanto do ponto de vista teórico-metodológico, por abrir novas perspectivas de análise da questão criminal na cidade.",Alexandre da Silva Medeiros
2004,RS,SOCIOLOGIA,Transformações do trabalho e política pública de qualificação profissional: o trabalho em serviços à pessoa.,"Na presente tese busca-se verificar em que medida a ação estatal voltada à formação profissional dos trabalhadores em serviços à pessoa, situados em posições socialmente menos privilegiadas, pode contribuir para a melhoria do desempenho desses indivíduos em suas atividades de trabalho e, no limite, de suas oportunidades de ocupação e rendimento. Em uma perspectiva mais ampla, procura-se refletir acerca das potencialidades de uma política pública de qualificação do trabalhador, tal como o Planfor, em sua implementação do Plano Estadual de Qualificação do Rio Grande de Sul, tomada como parte constitutiva de um projeto de desenvolvimento social democrático , para propiciar a redução das desigualdades sociais no mercado de trabalho, particularmente quanto a relações de gênero, geracionais e por grau de escolaridade.  Em suas linhas gerais, a análise orientou-se pela Teoria da Estruturação formulada por Anthony Giddens. Considera-se o Estado como agente da referida política pública de qualificação cuja atuação, porém, enfrenta as limitações impostas pela estrutura produtiva, pelo mercado de trabalho e também do próprio aparato estatal. Os egressos dos cursos de qualificação oferecidos por essa política pública são também considerados agentes, embora limitados pelos recursos econômicos, sociais e culturais que se encontram ao seu alcance. Na dimensão histórico-sociológica, o estudo destaca as transformações do trabalho, expressas especialmente pela flexibilização das relações de trabalho e pela fragmentação dos coletivos de trabalhadores. É no bojo desse processo que se expandem as atividades de serviços, em que se associam o trabalho da mulher e a ausência de proteção legal. É também nesse contexto que emerge um novo perfil de trabalhador, no que concerne à qualificação profissional. Nesta tese, investiga-se também verificar, quais são os ganhos, entre os egressos dos cursos da área de serviços à pessoa, tanto em termos do desenvolvimento de habilidades específicas e operacionais, quanto em termos de habilidades sociais e pessoais.",Ivonilda Mello Hansen
2004,DF,SOCIOLOGIA,Formação e Fixação de Pesquisadores na Região Norte do Brasil: o Projeto Norte de Pós-Graduação e Pesquisa/Capes,"A presente dissertação de mestrado tem como temática o desequilíbrio existente entre a base técnico-científica que se verifica na região norte do Brasil em relação às demais regiões. Ainda, as conseqüências deste desequilíbrio para o sistema de pós-graduação das IES amazônicas, tendo em vista as dificuldades para o processo de formação e fixação de docentes pesquisadores na região. O objetivo é promover uma análise crítica das ações do Projeto Norte de Pós-Graduação e Pesquisa-PNOPG, a partir da evolução dos índices e indicadores utilizados pela Fundação Coordenação de Aperfeiçoamento de Pessoal de Nível Superior-CAPES, para avaliar a expansão do sistema de pós-graduação no país. A intenção é medir a eficácia deste instrumento de política pública, o PNOPG, na redução dos índices de desequilíbrio da base técnico-científica. Concluímos que as ações do PNOPG foram de fato responsáveis pela expansão do sistema de C&T na Amazônia, no entanto, algumas limitações impediram um avanço maior deste sistema. Estas razões estão ligadas a não participação de alguns setores no processo e a ausência de uma ação conjunta com outros atores interessados no encaminhamento das ações referentes ao Projeto Norte de Pós-Graduação e Pesquisa.",Manoel Santana Cardoso
2004,DF,SOCIOLOGIA,A tendência concentradora do desenvolvimento científico e tecnológico no mundo contemporâneo,"O conhecimento técnico-científico representa no mundo contemporâneo uma base fundamental para o desenvolvimento sócio-econômico das nações. Sua maior ou menor utilização nas estruturas organizacionais e produtivas de cada sociedade pode ser um dos fatores explicativos dos diferentes graus de desenvolvimento alcançados. Sua produção e apropriação encontram-se, entretanto, muito concentradas num grupo de países mais desenvolvidos..Esta tese tem, assim, como objetivo principal dar maior visibilidade e compreensão a essa questão. Para tanto, desenvolve-se, inicialmente, uma análise da organização social da produção do conhecimento e suas transformações mais recentes. Em seguida, mostra-se as grandes diferenças estruturais que existem entre os países considerados desenvolvidos e aqueles em desenvolvimento. São vistos, dessa forma, suas diferentes formações históricas e culturais, as características gerais de seus sistemas de ciência e tecnologia, a maneira como têm sido conduzidas suas políticas científicas e tecnológicas, os resultados obtidos e a configuração dos principais problemas e desafios a serem enfrentados..A comparação entre os dois grupos de países analisados leva ao delineamento de uma forte concentração da produção científica e tecnológica no bloco denominado de Tríade, ou seja, Estados Unidos, Japão e o conjunto de países que formavam a União Européia até 2003. Observa-se, ao mesmo tempo, que esta realidade não é estática. Ela vem experimentando pequenas transformações, seja no âmbito do próprio grupo mais desenvolvido, seja com relação aos países em desenvolvimento. Mas, essas transformações não chegam a alterar substantivamente a situação de alta concentração que se manteve relativamente estável ao longo da última década..Conclui-se, assim, que para que essa tendência não se cristalize ainda mais num futuro próximo, será importante que os países em desenvolvimento passem a implementar políticas públicas, mais incisivas e adequadas às suas realidades,visando maior participação na produção e apropriação do conhecimento. A cooperação internacional mais ajustada aos interesses desses países, bem como o desenvolvimento de ações mais efetivas e eficazes por parte de organismos internacionais poderão vir a contribuir de forma mais significativa para a construção de uma sociedade global mais homogeneamente desenvolvida.",Fernando Antônio Ferreira de Barros
2005,RJ,SOCIOLOGIA E ANTROPOLOGIA,"Informática, educação e desigualdade social nas escolas públicas brasileiras.","Este trabalho analisa como o uso da tecnologia na educação básica brasileira é influenciado pelo contexto cultural. Eu examino como contexto molda a capacidade da tecnologia de melhorar a qualidade e a equidade de educação. Descrevo os impactos que as tecnologias educacionais tem sobre os ambientes onde são utilizadas. Esta pesquisa centrou-se nas iniciativas educacionais difundidas que propõem melhorar a igualdade na educação pública através do uso crescente da tecnologia. Uso uma combinação de observação participativa em sala de aula e congressos educacionais, entrevistas com educadores e administradores, e análise do discurso público sobre o relacionamento entre tecnologia, educação e inclusão social, para analisar os padrões do uso de tecnologia nas escolas brasileiras e seu impacto sobre igualdade.",JULIANE MARIA IDA REMOLD
