ano,UF,nome_programa,titulo,resumo,autor
2005,RJ,SOCIOLOGIA E ANTROPOLOGIA,"Estratégias coletivas em torno da formação universitária: status, igualdade e mobilidade entre desfavorecidos.","Este trabalho tem como tema central a ascensão social de indivíduos em meio à adversidade econômica e cultural. Com a biografia de nove estudantes universitários, procuro demonstrar que seus percursos sociais foram pouco determinados pelo investimento, práticas e estratégias de classificação social presentes em suas configurações familiares. Sugerindo interpretação distinta ao paradigma dominante da Sociologia da Educação e Desigualdades no Brasil, aponto que os filhos das classes populares são mais suscetíveis à conjuntura política, às práticas democráticas da sociedade civil, às políticas públicas, aos blocos de status, aos movimentos sociais, e ao desenvolvimento econômico para que possam chegar estruturalmente ao ensino superior, tornar os diplomas adquiridos mais rentáveis e desenvolver, assim, uma trajetória de sucesso.",GABRIELA DE SOUZA HONORATO
2005,SC,SOCIOLOGIA POLÍTICA,O ProInfo em Santa Catarina: uma análise sociotécnica das capacitações (2002-2004),"Este trabalho tem como objetivo investigar o Programa Nacional de Informática na Educação – ProInfo, que visa introduzir e disseminar o uso das Novas Tecnologias da Comunicação e Informação (NTCI), através da utilização de computadores na rede pública de ensino brasileira. O foco centrou-se nas capacitações realizadas em Santa Catarina, no período 2002-2004, através, principalmente, de um olhar participante em algumas destas. Este interesse decorre das mudanças de ordem política, social, econômica e cultural advindas do alto grau de desenvolvimento alcançado por essas tecnologias nas últimas três décadas. Dentre uma série de implicações neste processo, destaca-se a mudança na própria concepção de trabalho, que passou a demandar uma reorganização do sistema educacional. A hipótese que orientou a nossa pesquisa foi a de que, através de políticas públicas, como o ProInfo, as tecnologias estão sendo constantemente reinventadas numa história que não acaba, mas pelo contrário, que é trasladada, retraduzida, negociada, a partir de conflitos e convergências de interesses. Neste caso, o período de transição política, como o estudado, pode estabelecer, ou não, uma descontinuidade nos processos de estruturação da rede criada para implantar o Programa. Na medida em que o mesmo supõe uma ação educacional de caráter inovador, ele está ainda mais sujeito aos avanços e recuos das instituições públicas. No intuito de subsidiar os nossos questionamentos utilizamo-nos como proposta teórico-metodológica a abordagem ‘Ator-Rede’, tal como desenvolvida por Bruno Latour. Acreditamos que o alto grau de complexidade que se estabelece nas redes-de-atores envolvidas em ações amplas, inovadoras e presentes em todas as esferas da sociedade contemporânea, acabam por gerar uma necessidade de se investigar permanentemente os seus processos de implementação. O que pudemos depreender de tantas mudanças políticas observadas durante o nosso trabalho é que em tais condições se torna difícil conduzir uma política pública conseqüente, que obedeça a um planejamento criterioso e permita alcançar as metas estabelecidas.",Renato Salazar
2005,RS,SOCIOLOGIA,A dinâmica da educação superior: um estudo sobre as universidade do RS.,"Esse trabalho de dissertação tem como objetivo analisar as transformações que ocorrerram na educação superior ao longo dos anos de 1990, realizando, uma abordagem sobre as universidade do Rio Grande do Sul. Na década de 1990 o sistema de ensino superior sofreu uma série de reformulações, provenientes tanto de medidas governamentais de âmbito nacional, quanto de organismos internacionais, ambos interessadas na expansão desse nível de ensino. Com isso, observa-se uma nova fase da educação superior, que, baseada na expansão, trouxe como características a diversidade das isntituições e da oferta de cursos, a flexibildiade curricular e a avaliação. Com o objetivo de investigar como ocorreu  essa nova fase da educação nas universidades públicas  e particulares do RS,  foram analisados dados quantitativos referentes às vagas ofertadas , ao número de matriculados  e cursos de graduação  entre 19994 e 2000, período  em que a educação no Brasil  demonstra  os maiores números  referentes à expansão . No que se refere  à qualidade  da educação superior , foram analisados  os conceitos obtidos  por essas instituições  e seus cursos  de graduação no Exame Nacional  de Cursos, realizados  pelo Ministério  da Educação  entre 1996 e 2002. Também foram  analisados  os perfis  sócio-econômicos  dos alunos de diferentes  áreas  de conhecimento, buscando  observar se ocorreram  mudanças na demanda  por esse nível de enisno. Os resultados  analisados indicam  que as universidades  privadas apresentaram-se como principais  responsáveis por essa  dinâmica de expansão ; enquanto que as públicas  procuraram ""ajustar-se"" à nova demanda da sociedade e do mercado .A singularidade  das universidades  pode ser analisada nos conceitos obtidos  no exame aplicado  pelo Ministério da Educação, indicando  a contradição  entre uma avaliação  homogênia e a diversidade do sistema de ensino. A diversificação  apresentada  pelo sistema  de ensino tambén foi observada no que se refere  ao perifl discente , indicando a absorção de parcelas da população cada vez mais jovens, provenientes de  famílias com um maior montante de capital cultural.",Cassiane Freitas Paixão
2005,RS,SOCIOLOGIA,A discriminação racial em números e palavras. Estudo sobre a aprticipação de negros e brancos no mercado de trabalho do Rio Grande do Sul.,"O tema deste trabalho é a discriminação racial no mercado de trabalho do Rio Grande do Sul. Analisamos a forma de participação dos indivíduos brancos e negros nessa esfera social, procurando investigar a influência da discriminação racial sobre as desigualdades existentes entre esses dois grupos raciais. Verificamos a relação existente entre a desigualdade sócioeconômica e a desigualdade na forma de participação no mercado de trabalho. Por outro lado, apresentamos também exemplos de discriminação racial, ao analisar queixas de crimes de preconceito de cor ou raça registrados nas delegacias de polícia do Rio Grande do Sul entre 1998 e 2003, referente ao cotidiano das relações de trabalho dos indivíduos negros. Assim, pudemos construir uma categorização das queixas de discriminação racial e examinar o discurso racial como forma de construção de uma identidade estigmatizada e estereotipada concebida para os negros",Luciana Garcia de Mello
2006,RJ,SOCIOLOGIA E ANTROPOLOGIA,Inclusão social e assimetria de informação no sistema de Ensino Superior Brasileiro: uma analise comparativa,"Esta dissertação investiga a extensão, as conseqüências e as bases de reprodução da assimetria de informação no Sistema de Ensino Superior brasileiro, valendo-se de alguns contrapontos com a regulação do mercado do ensino superior norte-americano. Analisa a produção e veiculação de informação sobre o ensino superior brasileiro por parte de três atores ou segmentos-chave: o MEC; a comunidade e a mídia. A conclusão é que a assimetria de informação tem sido até agora um non-issue no Brasil; um assunto que não entra em questão nos foros dos três atores estudados e que prejudica desde as escolhas individuais de carreiras e instituições, até o próprio desenvolvimento das instituições e do sistema como um todo.",THAIS SENA SCHETTINO
2006,RJ,SOCIOLOGIA E ANTROPOLOGIA,Educação profissional e aprendizagem do trabalho na nova ordem econômica.,"Esta pesquisa objetiva o estudo e a análise do processo de articulação entre a formação geral e a formação técnica na educação Profissional através das práticas pedagógicas. Para tanto, realizamos uma pesquisa de campo em uma escola técnica de nível médio na cidade de Niterói, Estado do Rio de Janeiro, em que foram entrevistados professores, coordenadores, diretores e orientadores educacionais desta instituição...	A opção por estes profissionais deve-se a iniciativa desta pesquisa de mapear o campo em que se insere a Educação Profissional no processo de formação do trabalhador técnico, a partir da visão daqueles que operacionalizam estas práticas sociais no ambiente escolar...	A análise deste material aponta para uma histórica ""dualidade estrutural"" (KUENZER, 1997) entre a formação geral e a formação técnica nesta modalidade de ensino, acarretando inúmeras contradições entre as exigências colocadas pela nova ordem econômica e o perfil do trabalhador inserido no mundo do trabalho.",MONICA FERREIRA DE FARIAS
2006,SP,SOCIOLOGIA,Os andaimes do novo voluntariado,"Esta dissertação trata do aparecimento, no cenário público da segunda metade da década de 1990, do chamado novo voluntariado. Tomando essa emergência como resultado de esforços de definição, divulgação e convite ao envolvimento com ele, o texto se desenvolve no sentido de apresentar o novo voluntariado como uma construção e não como resultado da soma de iniciativas pessoais espontâneas, incentivadas por um sentimento cívico individualmente gestado.A construção de novo voluntariado foi considerada em duas vertentes: a primeira é a das relações entre atores que deram sustentação e visibilidade ao novo voluntariado como opção de ação de enfrentamento de problemas sociais, especificamente os relacionados ao aumento da desigualdade. Os principais promotores de suas idéias foram o Comunidade Solidária e o Programa Voluntários (criados no primeiro mandato do presidente Fernando Henrique Cardoso e atrelados à esfera estatal) e os empresários que passaram a atuar no que se convencionou chamar de responsabilidade social das empresas. A segunda face dessa construção é a da idéia mesma de novidade, que define o trabalho voluntário desse período como uma ação que se diferencia de outras anteriores (desde ações filantrópicas até ações que remetam aos moldes de movimentos sociais ou organizações coletivas de reivindicação) e sinaliza um momento de amadurecimento e aperfeiçoamento nas formas de participação social. O texto está dividido em três capítulos: o primeiro descreve o trabalho voluntário tal como apresentado pela fala das instituições e atores que o promoveram, bem como o contexto em que ela se deu. Fala-se, portanto, em terceiro setor, organizações não governamentais, cidadania empresarial. O segundo capítulo dedica-se à descrição de como as relações entre os atores promotores do novo voluntariado nos anos de 1990 incidiram, em momentos históricos anteriores, sobre o entendimento e o tratamento de problemas sociais e sobre o funcionamento da área de atuação das instituições dedicadas a eles. Foram adicionados dois outros atores de presença tradicional na área social e que não figuram entre os promotores do novo voluntariado: a Igreja Católica e os profissionais do Serviço Social. São retomadas, desta maneira, as relações entre esses quatro atores - Estado, empresários, Igreja e profissionais do Serviço Social - nas décadas de 1930, 1960 e 1990, de modo que o que se define como sendo novo no voluntariado possa ser considerado a partir dessa perspectiva. No terceiro capítulo, a análise da configuração das relações entre aqueles atores e da elaboração da imagem e do discurso do novo voluntariado é aprofundada e estabelece conexões entre esse processo de construção e questões mais amplas relacionadas à reestruturação do Estado e garantia de direitos",Marcia Pereira Cunha
2006,SP,SOCIOLOGIA,Palavra e terra: princípios de uma pedagogia guarani,"O objetivo desta pesquisa foi o de fazer uma análise da percepção dos Guarani da Aldeia Ribeirão Silveiras, localizada entre os municípios de São Sebastião e Bertioga litoral norte de São Paulo, sobre a existência de uma instituição social alheia a seus costumes tradicionais, como a escola. Por outro lado, investigamos os processos tradicionais da educação guarani, tentando compreender a participação dos remanescentes da Mata Atlântica neste processo, como também a influência do mito. Demonstramos que a educação tradicional dos Guarani deve ser compreendida como a junção da “palavra guarani” com a “terra guarani” criando, desta forma, como pano de fundo, uma explicação mítica do mundo e que a escola para eles tem como função instrumental a “tradução” dos conhecimentos da sociedade não indígena. Palavras chaves: Mito, Terra sem Mal, Educação, Escola, Guarani, Mata Atlântica.",Marivaldo Aparecido de Carvalho
2007,PB,SOCIOLOGIA,Experiências Individuais de Envelhecimento: estigmas e a alfabetização na terceira idade.,"O presente trabalho é o resultado de minha pesquisa sobre as experiências de alfabetização para idosos beneficiados por políticas de inclusão e participação em grupos para terceira idade. A metodologia etnográfica baseou-se em observação direta da prática pedagógica no projeto de Educação de Jovens e Adultos realizado no Centro Municipal de Convivência do Idoso da Prefeitura Municipal de Campina Grande – PB, no período de 2006. As conclusões permitem mostrar que mesmo tardiamente a educação é benéfica, trazendo resultados positivos para os idosos. Além disso, verificou-se que a alfabetização contribuiu para qualificar o idoso, tornando-o um novo cidadão, consciente de seus direitos, melhor sintonizado com as transformações sociais e mais determinados a lutar contra preconceitos.",Elânia de Moura Rocha
2007,PE,SOCIOLOGIA,ARTICULAÇÃO ENTRE DISCURSOS GLOBAIS E LOCAIS NA DEFINIÇÃO DA INTERPRETAÇÃO LEGÍTIMA DE UNIVERSIDADE NAS PROPOSTAS DE REFORMA DA EDUCAÇÃO SUPERIOR NO BRASIL,"Inserida no campo de estudos sociológicos sobre o papel da instituição universitária na sociedade contemporânea, esta tese problematiza questões relativas à construção social de discursos sobre a universidade por parte de organismos e instituições internacionais e entidades nacionais no contexto de reforma da educação superior em curso no Brasil, tendo como unidade de análise quarenta propostas de reforma da educação superior, vinte e duas internacionais e dezoito nacionais.  O processo de análise contempla os discursos em contenda, as temáticas colocadas na agenda de discussão sobre a reforma e seus protagonistas, considerados interlocutores autorizados e legítimos, partícipes do campo da educação superior brasileiro. A abordagem sociológica bourdieusiana constitui a referência teórico-metodológica principal, cujas noções e conceitos, como campo, posição, condições materiais e simbólicas são utilizados no estudo dos discursos dos interlocutores da reforma, análise complementada com a proposta teórica de Fairclough, o qual focaliza o discurso a partir da consideração de três momentos interdependentes: o discurso como texto, como prática discursiva e como prática social. A análise se volta para as temáticas colocadas na agenda de debate; a relação entre as temáticas e seus interlocutores; as concepções de educação superior, sobretudo, de universidade, defendidas por esses interlocutores; as orientações/recomendações indicadas para a reestruturação da universidade na sociedade brasileira e as posições, no campo em referência, equivalentes e divergentes quanto à matéria. A disputa pela definição da interpretação legítima de universidade depende do poder de mobilização dos interlocutores, avaliado, nesta tese, em termos do acolhimento ou não de suas propostas nas versões do anteprojeto de lei e no PL 7.200/2006 do MEC. São utilizadas, também, referências discursivas globais, representadas pelo BIRD, UNESCO, OMC e agentes e instituições do Processo de Bolonha nas estratégias de luta dos interlocutores nacionais, fundamentando suas posições sobre as concepções de universidade. Entretanto, não se pode afirmar, apenas, que existe uma reprodução de interpretações, advindas de campos exteriores ao brasileiro. Há, por outro lado, a presença de temas globais, os quais se impõem nas propostas de reforma dos interlocutores nacionais e de temas específicos, próprios do campo da educação superior brasileiro.  Configura-se, pois, uma articulação entre discursos globais e locais nas diferentes propostas de reforma nacionais, no processo de luta em torno da concepção de universidade, onde, somente, algumas instituições detêm as condições materiais e simbólicas, necessárias à definição social legítima de instituição universitária.",MARIA CREUSA DE ARAÚJO BORGES
2007,RJ,SOCIOLOGIA E ANTROPOLOGIA,Novas tecnologias do ponto de vista docente.,"O presente trabalho visa apreender a relação entre novas tecnologias de informação e de educação. Considerada uma grande promessa na diminuição das desigualdades, a tecnologia ataca diretamente a eficiência, o aprendizado e o aperfeiçoamento dos professores. Essa relação é observada a partir da visão do docente, entendendo que os professores são os agentes viabilizadores da introdução da tecnologia e podem fornecer pistas da forma como a tecnologia é usada nas escolas, questão principal a ser elucidada neste tema. Como qualquer outro recurso ou inovação escolar, a sua implantação é influenciada pelo contexto social que o cerca. E, neste sentido, a abordagem dos estabelecimentos escolares , cujo pressuposto é de que as escolas podem fazer a diferença na trajetória escolar dos estudante, permite, de maneira dinâmica, perceber que todas as decisões são permeadas pelas interações individuais em todos os níveis, desde a sala de aula até o âmbito institucional.",CARLA RENATA BRAGA CORREA
2007,RJ,SOCIOLOGIA E ANTROPOLOGIA,"Nem sucesso, nem fracasso: uma abordagem etnográfica de uma escola.",Esta dissertação é fruto de um estudo de caso intensivo em uma escola na periferia de um município da Baixada Fluminense/RJ durante os anos 2003/2005. A partir da análise do ambiente da escola como um todo é apresentado  um breve panorama da situação educacional no Rio de Janeiro.,MARISA SANTANA DA ENCARNAÇÃO
2007,RJ,SOCIOLOGIA E ANTROPOLOGIA,Operários negros - Relação entre cor e trabalho na nova indústria automotiva do Rio de Janeiro.,"Este trabalho tem como objetivo compreender as trajetórias profissionais de operários negros da indústria automobilística no Rio de Janeiro. Faço uma análise das desigualdades raciais no mercado de trabalho observando, por  um lado, os impactos econômicos e sociais ocasionados pela reestruturação da produção e das relações de trabalho e, por outro, as transformações ocorridas no modelo de relações raciais brasileiro...Utilizando a perspectiva analítica das desigualdades de oportunidades para negros e brancos no mercado de trabalho, pretendo demonstrar que apesar das transformações que vêm ocorrendo no campo do trabalho terem significado ampliação do mercado para todos os trabalhadores independente da cor/raça, verifica-se no caso estudado a reprodução das desigualdades de oportunidades entre negros e brancos no acesso e na qualidade das ocupações do setor industrial automotivo.",ALINE DE OLIVEIRA GONÇALVES
2007,PR,SOCIOLOGIA,EDUCAÇÃO E RELAÇÕES RACIAIS: UM ESTUDO DE CASO,"Esta pesquisa teve como pano de fundo as reflexões em relação ao tema das relações étnico-raciais no Brasil. O foco central de estudo foram as relações raciais e as práticas educativas em uma escola pública de Curitiba. Delimitou-se como universo de pesquisa o estudo de caso uma escola localizada na periferia da cidade de Curitiba. A partir de uma abordagem qualitativa de natureza interpretativa, foram entrevistados pedagogos, professores, funcionários e alunos para saber como se dão as relações étnico-raciais na escola. Analisou-se também como as práticas docentes têm contribuído para a discussão do papel da escola (problematizadora/reprodutora) em relação às práticas discriminatórias a negros no ambiente escolar. Além disso, à luz da lei 10.639 de 2003 sobre o ensino de História e Cultura Afro-Brasileiras, analisou-se como estão representados o negro e a história da África nos livros didáticos de história de 6ª e 7ª séries, qual é a visão dos professores e qual vem sendo sua prática pedagógica em sala de aula. A pesquisa evidenciou elementos que reafirmaram as hipóteses levantadas: formas de silenciamento da questão racial e de práticas discriminatórias na escola; a idéia de democracia racial brasileira perpassando o ambiente escolar; os livros didáticos analisados não avançaram na problematização e na desconstrução das imagens negativas dos negros, que ainda estão associadas à escravidão e à inferioridade do negro na formação cultural do País, principal reivindicação dos movimentos negros desde a década de 70; a lei 10.639/03, apesar de quatro anos de sua aprovação, é pouco conhecida e não está sendo colocada em prática pelos professores desta escola; há formas de racismo explícito e implícito no ambiente escolar, negado pelos professores, denotando estarem pouco preparados para lidar com a questão racial em sala de aula. No final da pesquisa, evidenciamos a importância da lei 10.639/03 para contribuir na problematização das relações raciais e apontar novos caminhos para diminuir as grandes diferenças sociais existentes no interior das escolas de todo o Brasil.",Abel Ribeiro dos Santos
2008,PE,SOCIOLOGIA,ANÁLISE DO DISCURSO POLÍTICO-IDEOLÓGICO DA REFORMA DA EDUCAÇÃO SUPERIOR DO GOVERNO LULA NA F. DE SÃO PAULO.,"Neste trabalho faz-se análise do discurso da reforma da educação superior no Governo Luís Inácio Lula da Silva, na Folha de São Paulo no período 2004-2006. Foi Primeiramente apresentado o ambiente em que a reforma foi formulada, em seguida apresenta-se o percurso teórico utilizado, com ênfase no papel da mídia impressa na.produção de discurso cujo efeito foi analisado segundo a perspectiva foucaultiana. Dentre os temas postos em evidência, pelo jornal, ganharam destaque autonomia, financiamento e relação setor público-privado. Os enunciados expostos em relação a cada um desses temas conduziram à indicação de duas formações discursivas conflituosas, organizando concepções de universidade, Estado e educação superior.",ANDRÉ ARAÚJO DE ANDRADE
2008,AL,SOCIOLOGIA,EDUCAÇÃO E IDEOLOGIA NO LIVRO DIDÁTICO:uma análise da relação entre o ensino da matemática e a vida social.,"O objetivo da dissertação é evidenciar os efeitos de sentido  das atividades educacionais do livro didático de matemática da 1ª série do ensino fundamental do MEC (Ministério da Educação), buscando desvendar elementos ideológicos nas propostas da educação básica. A pesquisa buscou elucidar estas questões partindo do materialismo dialético de Marx, cuja fundamentação teórico-metodológica está embasada na concepção – resgatada por Lukács – de  que o trabalho é o fundamento ontológico do ser social e das diversas formas de práxis. A educação  se desenvolve em uma dimensão particular da vida social que reproduz – pelo vínculo mantido com o trabalho – as condições econômicas de produção. Sendo a atual forma de sociabilidade capitalista, foi possível comprovar que as caracterizações ideológicas das atividades didáticas reproduzem por meio das idéias de compra, venda, salário, mercadoria etc. os interesses legitimadores da sociedade do capital. Por fim, chegamos a conclusão de que no ensino da matemática os conceitos numéricos e suas operações na forma de valores de troca se tornam parte natural de nossas vidas, sendo a educação uma instância de socialização fundamental para a reprodução do capital.",SYLVIO MARINHO DA PUREZA RAMIRES
2008,RJ,SOCIOLOGIA E ANTROPOLOGIA,Identidade e educação para  a fé Bahá´i no Brasil: um estudo antropológico.,"Esta dissertação investiga os processos de formação e fricção identitárias e as questões da educação conectadas aos dois, assim como a tomada de posição a partir do que foi aprendido e classificado como normal. Analisa como uma religião específica, a saber, a fé Baháí , utiliza essa mecanismo de formação de um ethos religioso, que compreende valores como a mobilidade, a flexibilidade, a educação e a reflexão, o “sacrifício” , a anti-hierarquia, anti-ritualização, a cortesia. O estudo dá ênfase especial a um determinado objetivo elaborado pelo pensamento religioso – o “fim das ideologias”, incorporado pela contrariedade ao nacionalismo – que é paulatinamente ensinado e absorvido pelos membros religiosos. O trabalho ainda analisa a polisemia do termo educação e como esses diferentes significados podem ser manipulados para objetivos diferentes.",CATHARINA EPPRECHT PEREIRA DE SOUZA
