ano,UF,nome_programa,titulo,resumo,autor
2009,RJ,SOCIOLOGIA E ANTROPOLOGIA,Transgressões ou reprodução? Discursos de homens e mulheres em profissões alternativas ao seu gênero.,"A dissertação pretende oferecer uma contribuição para o entendimento da relação entre gênero e ensino superior. Apesar de existir uma forte tendência à concentração por gênero em alguns cursos, como a Nutrição (mulheres) e a Engenharia Elétrica (homens), uma minoria de indivíduos consegue romper com as barreiras de gênero no que se refere à futura profissão. Nesse sentido, procuramos compreender: ....1) Por que alguns indivíduos transgridem as barreiras tradicionais de gênero? ....2) Como estes sujeitos ""deslocados"" desenvolvem suas trajetórias acadêmicas? ....3) Será que os homens do curso de Nutrição sofrem as mesmas dificuldades que as mulheres que cursam Engenharia? ....Para responder tais questões realizamos entrevista em profundidade com roteiro semi-estruturado com aluno(a)s de ambos cursos da Universidade Federal Fluminense. Os resultados da pesquisa mostram que os homens que freqüentam o curso de Nutrição enfrentam maiores obstáculos em sua trajetória acadêmica do que mulheres que cursam Engenharia. Enquanto que as mulheres parecem se adaptar às especialidades já existentes na Engenharia, os homens na Nutrição resistem a se integrarem neste universo profissional e passam a criar uma nova especialidade (tipicamente masculina) no interior do curso feminino. Além disso, percebemos ainda que o conjunto do(a)s estudantes do curso de Engenharia Elétrica possui visões mais igualitárias de gênero do que entre aquele(a)s da Nutrição",MANI TEBET AZEVEDO DE MARINS
2009,RJ,SOCIOLOGIA E ANTROPOLOGIA,Uma Escola de Luta: Análise dos significados da educação em um estudo de drama social.,"O presente trabalho visa compreender as representações de professores, diretores e representantes do poder público a respeito da educação a partir da análise de um conflito ocorrido entre membros de uma escola estadual da Zona Norte da cidade do Rio de Janeiro e a Secretaria de Educação. Utilizando o método do drama social, assinalo que os criadores de políticas públicas e os agentes nas escolas põem em práticas representações sobre o ensino e a possibilidade que os alunos tem de aprender. O que está em jogo nesta abordagem não é a qualidade de trabalho dos professores, mas sim uma possível dualidade na concepção de educação prevalecente entre professores e representantes do Estado. Isso significa que qualquer política implementada na escola deve ser encarada do ponto de vista de hábitos e práticas e professores e outros atores nas escolas, e não apenas de sua justificativa teórica.",SABRINA GALENO DA COSTA
2009,MG,SOCIOLOGIA,Deslocamentos urbanos e desigualdades.sociais: um estudo do movimento diário da.população de Belo Horizonte.Belo Horizonte.2009,"Esta é uma proposta de abordagem sociológica dos deslocamentos que as pessoas realizam.no espaço urbano para atingir os mais variados destinos. Postula-se que este conjunto de.deslocamentos é uma importante variável para compreensão da organização social no.espaço urbano. O foco do trabalho é a relação entre os deslocamentos pela cidade,.transportes e desigualdades sociais, cujo resultado imediato se expressa em padrões.diferentes de usos do tempo e do espaço urbano. Os dados são oriundos da Pesquisa de.Usos do Tempo realizada em Belo Horizonte e das Pesquisas Origem e Destino realizadas.na RMBH. Os resultados sugerem que as desigualdades sociais e os meios de transporte são.importantes para entender os padrões de deslocamentos e o acesso ao espaço urbano,.devendo então ser considerados na formulação de políticas de transporte",ARNALDO LÔPO MOT'ALVÃO NETO
2009,SP,SOCIOLOGIA,A EDUCAÇÃO NO PERÍODO DE TRANSIÇÃO SOCIALISTA: A.EXPERIÊNCIA CHINESA DA REVOLUÇÃO CULTURAL E AS MUDANÇAS.NO ENSINO E NAS RELAÇÕES DE PRODUÇÃO,"A presente pesquisa busca apresentar as transformações no ensino.ocorridas durante a Revolução Cultural Chinesa, incentivadas pela necessidade de se.avançar na sociedade de transição. Construir o novo homem é tarefa dos novos.planos pedagógicos; e superar o ensino burguês, atingir as massas e fortalecer a.ideologia proletária é fundamental..Apresentamos, brevemente, a questão da revolucionarização das relações de.produção, que era o objetivo central da Revolução Cultural visando atingir uma.sociedade comunista e, finalmente, a questão da superação da divisão entre trabalho.manual e intelectual será abordada como meio de facilitar a revolucionarização através.da referida mudança do ensino.",Mariana Delgado Barbieri Rezzaghi
2009,SP,SOCIOLOGIA,Elite Política Brasileira e a renegociação das dívidas do Crédito Rural - o caso da Bancada Ruralista,"O presente trabalho analisa do ponto de vista contextual a Medida Provisória nº 114 de 2003, convertida em Lei nº 10.696 no ano de 2003, a partir da ótica da elite política brasileira – especificamente a bancada ruralista. O estudo contempla a discussão, em plenário, dos parlamentares ruralistas sobre a MPV 114/03, que dispõe da renegociação das dívidas do crédito rural. A bancada ruralista é tida como um dos grupos conservadores do Congresso Nacional, com forte coesão interna e intensa capacidade de pressão junto ao Executivo e Legislativo brasileiro, para que seus interesses sejam contemplados. A proposta deste estudo visa entender a reprodução da desigualdade social a partir das renegociações dos recursos públicos aplicados no financiamento da produção agropecuária brasileira. Tanto financiamento como a renegociação das dívidas do crédito rural não contemplam equitativamente todos os produtores rurais, nos colocando diante de questões de justiça social ao não propiciar mecanismos para a redução da desigualdade social.",Orson José Roberto de Camargo
2009,GO,SOCIOLOGIA,"O mundo imaginado, mas nem tanto de Carmo Bernardes","Como manifestação cultural, a literatura é também forma de conhecimento da vida social; se ela não nos dá respostas, pode, entretanto, ampliar o campo das investigações sociais, deixando emergir como são percebidas algumas questões num determinado grupo, num determinado momento. Este estudo pretende discutir a emergência de certas questões sociais em duas obras do escritor mineiro-goiano Carmo Bernardes: Perpetinha: um drama.nos babaçuais (1991) e Santa Rita (1995). Buscamos verificar como estão transfigurados alguns aspectos da realidade nas duas obras, como, por exemplo, as relações entre homens e mulheres, e outras mais. A partir da forma como a literatura plasma estes temas, procuramos examinar como os mesmo são tratados pela teoria social (sociologia, antropologia e historiografia). O sertão, nos dois romances, aparece como local de fala contra-hegemônica, pois não se restringe a uma vitrine de signos, isto é, um mero levantamento de costumes,.paisagens e tipos humanos que correriam o risco de desaparecer em decorrência do processo de inserção da região à lógica capitalista, ou seja, em virtude da perda de materialidade que o sertão vem sofrendo ao longo das últimas décadas. Estas descrições servem como pano de fundo, como cenário para o desenvolvimento de outros temas, como as desigualdades, as injustiças, os preconceitos e a opressão dos trabalhadores.",Miryam Moreira Mastrella de Araújo
2009,DF,SOCIOLOGIA,A desigualdade racial de renda no Brasil: 1976-2006,"Esta pesquisa apresenta uma análise da desigualdade racial de renda no Brasil para investigar a validade da tese de que a sua persistência se deve preponderantemente ao peso exacerbado da origem social nos processos de estratificação caracterizando um regime de baixa mobilidade, no qual há ainda o complemento de efeitos menores da discriminação racial. A origem social e a discriminação prejudicam os negros em suas trajetórias, a primeira mais do que a última por causa da associação entre raça e estratificação legada pelo passado escravista. Porém, o complemento proporcionado pela discriminação é fundamental para gerar a persistência, pois na sua ausência o regime de mobilidade induziria uma equalização racial lenta. A análise é conduzida mediante técnicas estatísticas a partir de bases de dados que contêm as respostas aos questionários aplicados de 1976 a 2006 pela Pesquisa Nacional por Amostra de Domicílios, PNAD, realizada pelo Instituto Brasileiro de Geografia e Estatística, IBGE, com ênfase nos dados de 1976, 1986, 1996 e 2006. A desigualdade racial de renda considerada é a de renda domiciliar per capita entre brancos e negros, grupo formado pela agregação de pretos e pardos. A tese foi quebrada em seis hipóteses que guiaram a pesquisa e a análise dos dados. Todas as seis são compatíveis com os dados, corroborando a tese. Mostra-se progressivamente que: i) existe desigualdade racial de renda domiciliar per capita no Brasil; ii) essa desigualdade é persistente de 1976 a 2006, seu nível é relativamente constante; iii) os dois grupos raciais têm regimes de baixa mobilidade, o que denota importância da origem social nesses processos; iv) a principal fonte da desigualdade racial de renda é a diferença no nível da renda do trabalho de negros e brancos; v) a diferença no nível da renda do trabalho se deve preponderantemente às desigualdades educacionais entre negros e brancos; vi) as desigualdades educacionais entre os grupos raciais são em larga escala determinadas pela origem social.",Rafael Guerreiro Osório
2010,SP,SOCIOLOGIA,O charme (in)discreto do gosto burguês paulista: Estudo sociológico da distinção social em São Paulo,"Partindo dos confrontos que atravessam os estudos de sociologia do gosto na.Europa e na América do Norte, esta tese trata dos processos de distinção social pelo.gosto com ocupantes das mais altas posições na hierarquia social da cidade de São.Paulo. Num primeiro momento, aborda os itens simbólicos das hierarquias culturais.“legítimas” e as “técnicas da sociabilidade mundana” tal como se manifestam em.manuais de etiqueta, crônicas da vida mundana e críticas culturais, passando em revista.algumas estatísticas de dispersão social dos bens culturais e certas representações do.consumo encenadas no material da imprensa paulistana contemporânea. Num segundo.momento, o estudo se encaminha para a investigação de como frações das classes altas.de duas áreas residenciais de São Paulo (a dos Jardins e a de Alphaville) – marcadas por.disparidades associadas à estrutura e, sobretudo, à evolução no tempo do volume total.do capital - reagem a esses apelos de “estilização da vida”. A análise de seus confrontos.de preferência, realizada com base em entrevistas semi-diretivas, permite afirmar que os.processos de distinção e estigmatização seguem se revigorando através das.classificações conflitivas que explicitam habitus de classe e se atualizam através das.práticas e das escolhas estéticas.",Carolina Martins Pulici
2010,SP,SOCIOLOGIA,TRABALHO INFORMAL E DESEMPREGO: DESIGUALDADES SOCIAIS,"Este estudo demonstra, a partir de uma abordagem etnográfica, o processo de inserção e permanência de trabalhadores no mercado de trabalho informal; as formas de exploração, dominação e precarização do trabalho e suas  conseqüências sobre as condições de saúde, trabalho e vida dos trabalhadores, a partir de quatro grupos abordados mais diretamente: os.vendedores ambulantes; os catadores de materiais de reciclagem; os colhedores de laranja; e os pescadores de lagosta. A pesquisa revela as estratégias de resistência desenvolvidas pelos agentes informais no cotidiano de trabalho, bem como as formas de organização adotada por eles para tentar reverter a situação de pobreza e exploração. O posicionamento das várias instituições sociais e políticas – em particular os sindicatos, as cooperativas e as Organizações Não-Governamentais (ONGs), os movimentos sociais e, principalmente, o Estado – frente ao contexto da economia informal, é destacado neste estudo. O objetivo principal é analisar a articulação do trabalho informal e sua importância no modo de produção capitalista. Tal entendimento possibilita combater as reais causas do desemprego, da informalidade e da desigualdade social e econômica. Faz-se a crítica aos princípios do “empreendedorismo”, da “autonomia” e do “cooperativismo” como alternativas ao desemprego. As várias formas de trabalho na informalidade, como o trabalho “autônomo”; o trabalho por conta-própria; o trabalho.temporário; e o trabalho terceirizado, encobrem o caráter subordinado do trabalho informal aos setores dinâmicos da economia e, consequentemente, ao processo de acumulação capitalista. A falta de um contrato de trabalho, ou de um contrato que proteja totalmente o trabalhador, é considerada uma afronta à cidadania social. Sendo assim, o trabalhador informal deixa de ser visto como cidadão ou como sujeito de direitos. Esse problema se torna importante na medida em que analisamos o tipo de economia, o modelo de desenvolvimento e o papel do Estado como responsável pelas políticas públicas de educação; de saúde; de emprego; e de segurança, entre outras medidas voltadas a esse.segmento da população. Pensamos num modelo de desenvolvimento em que sejam considerados os interesses sociais e a defesa do meio ambiente. A prioridade devem ser os investimentos na educação, em primeiro lugar. Com uma educação básica e fundamental de qualidade, podemos vislumbrar uma possibilidade de desenvolvimento com inclusão social. Os direitos de cidadania, nesse caso, se traduzem em ter acesso à educação, aos serviços de saúde, ao trabalho decente e à segurança, entre outras necessidades, para todos.",Myrian Matsuo Affonso Beltrão
2010,SP,SOCIOLOGIA,"Educação Superior, Emprego e Renda: uma relação problemática.  RMSP.  2002 – 2009","Este estudo investigou a relação entre educação e renda a fim de entender os limites da educação superior como promotora do bem-estar individual e social. Pretende, assim, contribuir para a análise dos impactos, no curto prazo, da educação superior sobre o mercado de trabalho e sobre a renda dos trabalhadores em seu conjunto. A escolha do recorte de tempo,.2002-2009, é particular porque é o momento no qual as dinâmicas de três processos sociais, aparentemente sem muita sinergia entre eles, começam a se encontrar. Os processos são: (i) a expansão do acesso ao ensino superior, particularmente do setor privado; (ii) a reestruturação do mercado de trabalho na RMSP – Região Metropolitana de São Paulo; e (iii) o crescimento.da PIA – População em Idade Ativa. A questão que se colocou foi entender quais arranjos sociais seriam feitos para dar conta da maior entrada de pessoas mais jovens e mais escolarizadas num mercado de trabalho que redefinia a sua estrutura de oportunidades. Foram utilizados os bancos de dados da PME – Pesquisa Mensal de Emprego do IBGE para as análises cross section dos mesmos pares de indivíduos em dois momentos, 2002-2003 e 2008-2009, fornecendo elementos descritivos para a compreensão da relação em foco. Modelos probabilísticos – Logit e OLogit – foram modelados para a mensuração dos impactos, entre 2002 e 2009, da escolaridade sobre a ocupação (emprego ou desemprego); da escolaridade sobre a qualidade da ocupação (mercado formal ou mercado informal); e os impactos na renda.recebida pelos indivíduos segundo as características de escolaridade, idade, gênero, cor, condição na família e inserção no mercado de trabalho. Entre outras conclusões, os resultados desta investigação reafirmam as possibilidades muito maiores do trabalhador com ensino superior de estar nos estratos superiores de renda, mas destacam que ele perdeu importância.para fins de empregabilidade no período analisado, ao contrário do trabalhador com ensino médio cuja importância aumenta para fins de empregabilidade.",Thais Helena de Alcântara Peres
2010,SP,SOCIOLOGIA,"Estado, Sociedade e Políticas Públicas de Educação: O PCN de História no contexto das políticas neoliberais dos anos de 1990","Esta pesquisa concentra-se no estudo de uma política pública educacional brasileira para o Ensino Fundamental I, que se institucionaliza a partir dos anos 90 no Brasil, mais especificamente em 1996-97, influenciada pela conjuntura política, econômica e social de décadas anteriores. Tem como objeto de estudo o documento oficial de política educacional: PCN de História para o Ensino Fundamental I. Para tanto, esta pesquisa se dividirá em dois importantes momentos. O primeiro dará destaque a uma investigação e análise dos objetivos e estratégias do Banco Mundial, especialmente, e demais organismos internacionais para as políticas públicas de educação básica I - no Brasil - na década de 90 do século passado. E o segundo momento dará destaque à investigação do PCN de História para o Ensino Fundamental I e seus fundamentos teóricos. A pesquisa tem como objetivo verificar se esta política curricular possui uma proposta subjacente aos objetivos dos organismos internacionais, colocando-se como elemento auxiliador destes para execução de suas metas. Sendo assim, a tese aqui revelada é a de que o PCN de História para o Ensino Fundamental I possui um caráter alienador, uma vez que apresenta uma proposta subserviente à lógica do capital, em detrimento de uma lógica humanizadora.",ANA FERNANDA INOCENTE OLIVEIRA
2010,DF,SOCIOLOGIA,Ações afirmativas no Brasil: um estudo de caso sobre o Estatuto de Igualdade Racial,"O trabalho busca analisar o contexto sociopolítico da aprovação, em 2010, do Estatuto da Igualdade Racial, pelo Congresso Nacional. Para tanto, investiga: 1) a chegada da noção de ações afirmativas ao Brasil, tendo se materializado aqui em políticas com recorte racial, em especial, as políticas de cotas para o acesso de negros no ensino superior 2) o histórico de projetos de lei com conteúdo de ação afirmativa que já passaram pelo Congresso, até a apresentação, em 2000, do Estatuto da Igualdade Racial, projeto de lei que reúne variadas propostas para a população negra, no âmbito do acesso à justiça, à saúde, à educação, à terra e ao mercado de trabalho. 3) a forma como a militância negra, ao longo da história, tem se relacionado com o Estado brasileiro, a fim de ver atendidas suas demandas por igualdade substantiva. 4) questões pertinentes à representação política da população negra, por meio da análise de pesquisas que tratam da sub-representação de negros no parlamento e das possibilidades do voto étnico no Brasil. 5) os embates travados no Congresso Nacional, em torno do Estatuto da Igualdade Racial, projeto que, por tocar em questões de interesse de muitos grupos organizados, suscitou grandes polêmicas, que explicam o período de tramitação de dez anos até a sua aprovação.",Rafael Augusto da Costa Alencar
2011,PB,SOCIOLOGIA,"“A Presença da Cultura Popular em Três Grandes Eventos em João Pessoa: Fenart, São João e Festa das Neves”.","O presente trabalho pretende abordar a participação da cultura popular nas festas e eventos na cidade de João Pessoa no ano de 2010, como o FENART, a Festa das Neves e o São João. A partir da pesquisa de campo foi possível visualizar como esses grupos se encaixam na programação cultural da cidade. O tratamento diferenciado possibilitou enxergar ambiguidades na valorização da cultura. Os três eventos apresentaram formas diferentes de incluir a cultura popular. No FENART houve um tratamento desigual e desrespeitoso com os grupos populares, tendo em vista a dimensão do evento. Almejou-se atender um determinado tipo de público. O São João separou os palcos, e colocou os horários diferentes, além de ter dado maior visibilidade às quadrilhas. Na Festa das Neves houve uma mudança que melhorou a participação da cultura popular, centralizou a festa em um único espaço e alternando os horários. A pesquisa é feita a partir da fala dos mestres. ..Palavras-chave: cultura popular- ambiguidades- desigualdades- diferença.",Camila Maria Gomes Pinheiro
2011,RJ,SOCIOLOGIA,Consumos cultural como diversidad expresiva. Desigualdades en las construcciones simbólicas,x,Maximiliano Nicolás Duarte Acquistapace
2011,RJ,SOCIOLOGIA,A Vila Acaba Mundo e a Construção de Mundos Possíveis: Reflexões sobre uma  experiência de luta pela moradia,x,Renata Versiani Scott Varella
2011,SP,SOCIOLOGIA,"""Os pioneiros: a desigualdade digital entre membros das classes médias na cidade de São Paulo""","Este estudo teve como objetivo entender os modos de uso de computadores por diferentes.membros das camadas sociais médias na cidade de São Paulo, em um momento histórico de.aumento do consumo das classes menos privilegiadas. Levando-se em conta a teoria dos campos.de Bourdieu, a hipótese central deste estudo é a de que os diferentes modos de uso dos.computadores são originados a partir da distribuição desigual dos capitais econômico e cultural.entre membros dos diferentes grupos sociais pesquisados. Através da etnografia dos usos, foi.possível observar e comparar diversos modos de uso do computador e da internet que colaboram.com a hipótese central. Esta pesquisa apresenta as barreiras que a desigualdade digital impõe às.classes menos privilegiadas assim como também apresenta algumas estratégias de superação.dessas barreiras que essas classes adotam.",Jayr de Andrade Pimentel Neto
2011,SP,SOCIOLOGIA,"Retrato Cultural, Montevidéu entre Cumbias, Tambotes e Operas","Este trabalho indagou a respeito da relação entre gostos, práticas e padrões de consumo cultural e as modalidades de estratificação social — em particular, as classes — na Montevidéu dos anos 2000. .A hipótese guia do trabalho sustentava que o consumo cultural -os gostos, práticas e opções culturais- nestas coordenadas geográficas e temporais expressou não somente modalidades de integração social, como se acredita comumente no Uruguai, como também de legitimação/reprodução da desigualdade social. Em outras palavras, o consumo cultural no período em questão tem sido um fator fundamental de identificação social de classes e, portanto, mais uma ferramenta de distinção que um fator de coesão social. .Os montevideanos têm se aferrado fortemente a seus habitus de classe, especialmente àqueles considerados “gostos médios”, mais tradicionais e com pretensões de transversalidade social, apesar da presença de estilos de vida cada vez mais individualizados, produto de uma nova era cultural, mais tecnológica e cosmopolita, que interpela e tende a desordenar esta homologia cultural entre gostos e classes..Para analisar o espaço social do consumo cultural e delinear os aspectos objetivos e subjetivos, a partir de uma perspectiva relacional (Bourdieu) trabalhou se com analise estatístico de dados de consumo cultural e entrevistas a intermediários culturais.",María del Rosario Radakovich
2011,SP,SOCIOLOGIA,Entretempos: experiências de vida e resistência entre os Kaiowá e Guarani a partir de seus jovens,"Este trabalho consiste na etapa final da pesquisa “ENTRETEMPOS: experiências de vida e resistência entre os Kaiowá e Guarani e partir de seus jovens” que foi desenvolvida a partir de 2007, junto ao programa de Pós Graduação em Sociologia, nível doutorado, da FCL/UNESP/Araraquara, com o propósito de estudar o envolvimento de grupos de jovens, integrantes do povo Kaiowá e Guarani, nos projetos de vida e resistência de seu povo. A intenção, com a pesquisa, era de contribuir para a interlocução com a temática juvenil num contexto mais amplo, direcionando as discussões para a especificidade das questões da juventude junto aos povos indígenas e fornecendo elementos que contribuam para a visibilidade das múltiplas juventudes no país. A pesquisa foi desenvolvida a partir do método etnográfico, considerado como uma contribuição metodológica valiosa, por permitir explicar a experiência da pesquisa intercultural. A metodologia incorporou, ainda, a análise das narrativas espontâneas dos jovens professores Guarani e Kaiowá, ocorridas em contextos públicos, e materiais escritos, como avaliações de curso, planos de aula, documentos oficiais e oficiosos. O terreno de pesquisa foi o Curso Normal Médio – Formação de Professores Guarani e Kaiowá - “Ára Verá” e o Curso de Licenciatura Intercultural Indígena “Teko Arandu”, a partir dos quais foi possível o acesso aos jovens professores Guarani e Kaiowá, especialmente da Aldeia Te’ýikue, município de Caarapó, Mato Grosso do Sul.",CELIA MARIA FOSTER SILVESTRE
